{
  "body": {
    "asset_path": "bodies/mhr-soma-v1.glb",
    "asset_sha256": "c1d0ec25c6f4708bb3e8d48811711da0d309598a6b85cf256975d49d1d46e841",
    "identity_sha256": "800babcf48d09f4ff1da9d2e8a0ebe266869a19849557450c7210c9a9fb9a1b6",
    "model_spec_id": "mhr-soma-v1",
    "model_spec_sha256": "e615b8485c367509833ee68b0405cd1e0ce6015604eaa4c1b2b699f4fc8d5144",
    "pose_asset_sha256": "8270809809ca874efed77257c96eb6b36be3afe50d126c177b8fade44e7329d3",
    "rest_surface_sha256": "caa66dff9b3625771c8f4c35bfe59556d30acdc3800880106f98f0ce75c49a95",
    "topology_sha256": "e0ca7ee25dc0b4c8d841bb2626e364bb88b7af7fae037e30854728842e320a18"
  },
  "design": {
    "id": "line-v1",
    "name": "Line",
    "sha256": "797a2b03da3f912b0647635a965155bfd05fff948f5e01651f03bbec2196c035",
    "source": {
      "kind": "generated",
      "model": "deterministic-fixture",
      "prompt": "single line",
      "seed": 0
    },
    "svg": "<svg xmlns=\"http://www.w3.org/2000/svg\" viewBox=\"0 0 30 30\"><path d=\"M 5 15 L 25 15\" fill=\"none\" stroke=\"#111\" stroke-width=\"0.5\"/></svg>"
  },
  "placement": {
    "anchor": {
      "barycentric": [
        0.3333333333333333,
        0.3333333333333333,
        0.3333333333333333
      ],
      "face": 8729
    },
    "design_id": "line-v1",
    "id": "p-forearm-spiral",
    "mirror": false,
    "rotation_rad": 0,
    "size_mm": [
      30,
      30
    ],
    "source_sha256": "390697a4389d4ec3bac473875d847b536d9c692a08b070b5f0422211675a9c18"
  },
  "pose": {
    "catalog_sha256": "e1fd20ba2ce88319116eaba5bcbdb8836c6578b1bcebc9eb11cc524ca28e2e17",
    "id": "reclined-left-arm-supported",
    "posed_surface_sha256": "c491a143c6a0af0af5f9ddc0b5dfe2bb8a75f31f7823437487043440fca40da5",
    "source": "named",
    "world_from_body": [
      [
        -0.7313762248943698,
        0.34098710300364016,
        0.5906069871280268,
        0.6474227700909536
      ],
      [
        0.24859109579560615,
        0.9397395571735315,
        -0.23471691838134487,
        0.09957245292296603
      ],
      [
        -0.6350521905720821,
        -0.02484673556989029,
        -0.7720695272973283,
        0.5959024576057503
      ],
      [
        0.0,
        0.0,
        0.0,
        1.0
      ]
    ]
  },
  "provenance": {
    "created_at": "2026-09-04T00:00:00Z",
    "generator": "tatbot sim compile",
    "git_sha": "2048e5651148"
  },
  "robot": {
    "tool_id": "lutin-3rl-bugpin",
    "urdf_sha256": "f72836627e6a670cbcbaa7cca0500727dca8d06c0299dd75276918f07a03b781",
    "world_from_robot": [
      [
        1.0,
        0.0,
        0.0,
        0.0
      ],
      [
        0.0,
        1.0,
        0.0,
        0.0
      ],
      [
        0.0,
        0.0,
        1.0,
        0.0
      ],
      [
        0.0,
        0.0,
        0.0,
        1.0
      ]
    ]
  },
  "schema_version": 2,
  "seed": 7,
  "support": {
    "id": "tattoo-chair-left-armrest-v1",
    "world_from_nominal": [
      [
        1.0,
        0.0,
        0.0,
        0.0
      ],
      [
        0.0,
        1.0,
        0.0,
        0.0
      ],
      [
        0.0,
        0.0,
        1.0,
        0.0
      ],
      [
        0.0,
        0.0,
        0.0,
        1.0
      ]
    ]
  },
  "trace": {
    "compiler": "tatbot_sim.surface_trace",
    "compiler_version": 2,
    "sha256": "f911b69bd23ef2b5f9e3d006b4ad652b932fb3a05c5b8cda507c120420414468",
    "strokes": [
      [
        {
          "barycentric": [
            0.01869836853605855,
            0.06877549688680917,
            0.9125261345771323
          ],
          "face": 8935
        },
        {
          "barycentric": [
            0.01940648145479451,
            0.008777443855401638,
            0.9718160746898038
          ],
          "face": 8931
        },
        {
          "barycentric": [
            0.05373482861089407,
            0.08936760499707823,
            0.8568975663920277
          ],
          "face": 8931
        },
        {
          "barycentric": [
            0.08806317576699352,
            0.16995776613875443,
            0.741979058094252
          ],
          "face": 8931
        },
        {
          "barycentric": [
            0.12239152292309374,
            0.2505479272804314,
            0.6270605497964749
          ],
          "face": 8931
        },
        {
          "barycentric": [
            0.15671983810843393,
            0.33113801336668375,
            0.5121421485248824
          ],
          "face": 8931
        },
        {
          "barycentric": [
            0.19104818526453338,
            0.4117281745083603,
            0.3972236402271063
          ],
          "face": 8931
        },
        {
          "barycentric": [
            0.22537650044987348,
            0.49231826059461303,
            0.28230523895551357
          ],
          "face": 8931
        },
        {
          "barycentric": [
            0.2597048795767326,
            0.5729084967917135,
            0.16738662363155385
          ],
          "face": 8931
        },
        {
          "barycentric": [
            0.29403319476207285,
            0.6534985828779661,
            0.052468222359961014
          ],
          "face": 8931
        },
        {
          "barycentric": [
            0.07224592719384598,
            0.6703873592857403,
            0.2573667135204137
          ],
          "face": 8930
        },
        {
          "barycentric": [
            0.2051899811566029,
            0.6337567903668355,
            0.1610532284765616
          ],
          "face": 8930
        },
        {
          "barycentric": [
            0.33813403511935985,
            0.5971262214479306,
            0.06473974343270954
          ],
          "face": 8930
        },
        {
          "barycentric": [
            0.5338607285517619,
            0.4379240802047092,
            0.028215191243528937
          ],
          "face": 8728
        },
        {
          "barycentric": [
            0.4159818566180152,
            0.4697342449962818,
            0.11428389838570303
          ],
          "face": 8728
        },
        {
          "barycentric": [
            0.29810298468426855,
            0.5015444097878543,
            0.20035260552787718
          ],
          "face": 8728
        },
        {
          "barycentric": [
            0.1802240029672853,
            0.5333546042049466,
            0.2864213928277681
          ],
          "face": 8728
        },
        {
          "barycentric": [
            0.062345131033538614,
            0.5651647689965191,
            0.37249009996994226
          ],
          "face": 8728
        },
        {
          "barycentric": [
            0.40186762527282477,
            0.5345837002925883,
            0.06354867443458695
          ],
          "face": 8729
        },
        {
          "barycentric": [
            0.3676004793030789,
            0.4339585168129607,
            0.19844100388396052
          ],
          "face": 8729
        },
        {
          "barycentric": [
            0.3333333333333325,
            0.33333333333333354,
            0.33333333333333404
          ],
          "face": 8729
        },
        {
          "barycentric": [
            0.2990662511911097,
            0.2327083372826856,
            0.4682254115262047
          ],
          "face": 8729
        },
        {
          "barycentric": [
            0.26479904139384014,
            0.13208296637407924,
            0.6031179922320806
          ],
          "face": 8729
        },
        {
          "barycentric": [
            0.23053195925161685,
            0.03145797032343081,
            0.7380100704249524
          ],
          "face": 8729
        },
        {
          "barycentric": [
            0.7348492219766696,
            0.0640073336965544,
            0.20114344432677603
          ],
          "face": 8722
        },
        {
          "barycentric": [
            0.6689006491419112,
            0.15712544491568128,
            0.17397390594240753
          ],
          "face": 8722
        },
        {
          "barycentric": [
            0.6029519534681548,
            0.25024372958110097,
            0.14680431695074422
          ],
          "face": 8722
        },
        {
          "barycentric": [
            0.5370031349554005,
            0.3433621876928135,
            0.11963467735178603
          ],
          "face": 8722
        },
        {
          "barycentric": [
            0.4710545621206421,
            0.4364802989119404,
            0.09246513896741748
          ],
          "face": 8722
        },
        {
          "barycentric": [
            0.4051057436078878,
            0.5295987570236529,
            0.0652954993684593
          ],
          "face": 8722
        },
        {
          "barycentric": [
            0.3391571707731293,
            0.6227168682427799,
            0.03812596098409079
          ],
          "face": 8722
        },
        {
          "barycentric": [
            0.27320859793837116,
            0.7158349794619066,
            0.010956422599722319
          ],
          "face": 8722
        },
        {
          "barycentric": [
            0.7963984724982996,
            0.18845043905987005,
            0.015151088441830333
          ],
          "face": 8944
        },
        {
          "barycentric": [
            0.8684771901625697,
            0.09098213991361301,
            0.040540669923817184
          ],
          "face": 8944
        },
        {
          "barycentric": [
            0.00707705874231631,
            0.9347257649141641,
            0.05819717634351954
          ],
          "face": 8733
        },
        {
          "barycentric": [
            0.024915216070532556,
            0.8929502284284452,
            0.08213455550102226
          ],
          "face": 8732
        },
        {
          "barycentric": [